{
  "schemaVersion": 1,
  "id": "01JEXAMPLE0000000000000000",
  "type": "decision",
  "title": "Keep the core local-first",
  "content": "Milestone 1 makes no network requests.",
  "tags": ["architecture", "privacy"],
  "createdAt": "2026-01-01T00:00:00.000Z",
  "updatedAt": "2026-01-01T00:00:00.000Z",
  "source": "manual",
  "status": "active"
}
